{
  "crew": [
    {"id": "c001", "rank": "Master", "nationality": "Core Registry", "certifications": ["STCW Master"], "status": "active"},
    {"id": "c002", "rank": "Chief Officer", "nationality": "Core Registry", "certifications": ["STCW Officer"], "status": "active"},
    {"id": "c003", "rank": "Second Officer", "nationality": "Partner Registry", "certifications": ["STCW Officer"], "status": "active"},
    {"id": "c004", "rank": "Third Officer", "nationality": "Partner Registry", "certifications": ["STCW Officer"], "status": "active"},
    {"id": "c005", "rank": "Chief Engineer", "nationality": "Core Registry", "certifications": ["STCW Engineer"], "status": "active"},
    {"id": "c006", "rank": "Second Engineer", "nationality": "Partner Registry", "certifications": ["STCW Engineer"], "status": "active"},
    {"id": "c007", "rank": "Boatswain", "nationality": "Core Registry", "certifications": [], "status": "active"},
    {"id": "c008", "rank": "Able Seaman", "nationality": "Partner Registry", "certifications": [], "status": "active"},
    {"id": "c009", "rank": "Ordinary Seaman", "nationality": "Partner Registry", "certifications": [], "status": "active"},
    {"id": "c010", "rank": "Mess Attendant", "nationality": "Partner Registry", "certifications": [], "status": "active"},
    {"id": "c011", "rank": "Electrician", "nationality": "Core Registry", "certifications": ["Electrical Safety"], "status": "active"},
    {"id": "c012", "rank": "Fitter", "nationality": "Partner Registry", "certifications": [], "status": "active"}
  ],
  "rankDistribution": {
    "Master": 10,
    "Chief Officer": 10,
    "Officers": 20,
    "Ratings": 450,
    "Specialists": 75,
    "Support": 191
  },
  "nationalityBreakdown": {
    "Core Registry": 472,
    "Partner Registry": 284
  },
  "metadata": {
    "totalCrewCount": 756,
    "lastUpdated": "2025-01-15",
    "source": "Template Maritime Registry"
  }
}
